{
  "application_number": "20231123456789",
  "filing_date": "2023-11-01",
  "title": "Intelligent Patent Analysis System Using Machine Learning",
  "language": "en",
  "applicants": [
    {
      "name": "PatentTech Solutions Ltd.",
      "type": "company",
      "address": {
        "street": "123 Innovation Avenue, Tech District",
        "city": "Shenzhen",
        "state_province": "Guangdong",
        "postal_code": "518000",
        "country": "CN"
      },
      "contact_info": {
        "telephone": "+8613812345678",
        "fax": "+8675533332222",
        "email": "patents@patenttech.com"
      },
      "registration_number": "91440300MA5H123456"
    }
  ],
  "inventors": [
    {
      "name": "Dr. Li Wei",
      "address": {
        "street": "456 Research Road",
        "city": "Beijing",
        "country": "CN"
      },
      "nationality": "CN",
      "id_number": "110101198001011234"
    },
    {
      "name": "Prof. Wang Mei",
      "address": {
        "street": "789 Academic Street",
        "city": "Shanghai",
        "country": "CN"
      },
      "nationality": "CN",
      "id_number": "310101198512093456"
    }
  ],
  "classification": {
    "ipc": [
      "G06F 16/00"
    ],
    "cpc": [
      "G06F 16/232"
    ]
  },
  "priority_claims": [
    {
      "country": "US",
      "priority_date": "2023-05-01",
      "priority_number": "18/123,456"
    }
  ],
  "specification": {
    "description": "The present invention relates to a system and method for intelligent patent analysis using machine learning techniques. The system automatically analyzes patent documents to identify novelty, inventive step, and potential prior art references. The system includes natural language processing modules, classification algorithms, and similarity analysis tools. The invention aims to improve the efficiency and accuracy of patent examination processes by providing automated assistance to patent examiners. Key features include automated claim analysis, prior art searching, and examination recommendation generation.",
    "references": [
      {
        "citation": "CN101234567A",
        "relevance": "prior_art"
      },
      {
        "citation": "JP2023123456A",
        "relevance": "background"
      }
    ]
  },
  "claims": [
    {
      "claim_number": 1,
      "claim_text": "An intelligent patent analysis system comprising: a natural language processing module for extracting technical features from patent documents; a machine learning model trained to identify patentability criteria; and a recommendation engine for generating examination reports."
    },
    {
      "claim_number": 2,
      "claim_text": "The system of claim 1, wherein the machine learning model uses deep learning techniques to analyze patent content."
    },
    {
      "claim_number": 3,
      "claim_text": "A method for automated patent analysis using the system of claim 1, the method comprising: receiving a patent application; processing the application using natural language processing; generating patentability scores using the machine learning model; and producing examination recommendations."
    },
    {
      "claim_number": 4,
      "claim_text": "The method of claim 3, wherein the patentability scores include novelty score, inventive step score, and industrial applicability score."
    }
  ],
  "abstract": "An intelligent patent analysis system using machine learning techniques for automated examination of patent applications. The system includes natural language processing modules for feature extraction, machine learning models for patentability assessment, and recommendation engines for generating examination reports. The invention improves the efficiency and accuracy of patent examination by providing automated analysis of novelty, inventive step, and prior art references. The system can process applications in multiple languages and provides detailed explanation of examination decisions.",
  "drawings": [
    {
      "file_reference": "drawing-01.svg",
      "drawing_number": 1,
      "description": "System architecture diagram showing the main components of the intelligent patent analysis system",
      "figure_type": "drawing"
    },
    {
      "file_reference": "drawing-02.svg",
      "drawing_number": 2,
      "description": "Flowchart illustrating the patent analysis process steps",
      "figure_type": "drawing"
    },
    {
      "file_reference": "drawing-03.svg",
      "drawing_number": 3,
      "description": "User interface diagram showing the examination recommendation display",
      "figure_type": "drawing"
    }
  ]
}